<?xml version="1.0" encoding="UTF-8"?>

<!-- $Id $ -->

<jboss-ra xmlns="http://www.jboss.org/schema/ra"
          xmlns:xsi="http://www.w3.org/2001/XMLSchema-instance"
          xsi:schemaLocation="http://www.jboss.org/schema/ra
          http://www.jboss.org/schema/jboss-ra_2_0.xsd">
   <ra-config-property>
      <ra-config-property-name>myIntProperty</ra-config-property-name>
      <ra-config-property-type>java.lang.Integer</ra-config-property-type>
      <ra-config-property-value>8</ra-config-property-value>
   </ra-config-property>
   
   <ra-config-property override-element="connection-definition">
      <ra-config-property-name>myStringProperty</ra-config-property-name>
      <ra-config-property-type>java.lang.String</ra-config-property-type>
      <ra-config-property-value>newJCA</ra-config-property-value>
   </ra-config-property>   
   
    <ra-config-property override-element="activationspec">
       <ra-config-property-name>myBooleanProperty</ra-config-property-name>
       <ra-config-property-type>java.lang.Boolean</ra-config-property-type>
       <ra-config-property-value>false</ra-config-property-value>
    </ra-config-property>
    
 <bean-validation-groups>
   <bean-validation-group>org.jboss.jca.test.deployers.spec.rars.ra16standard303jbossra.FirstStep</bean-validation-group>
   <bean-validation-group>org.jboss.jca.test.deployers.spec.rars.ra16standard303jbossra.SecondStep</bean-validation-group>
 </bean-validation-groups> 
</jboss-ra>