<?xml version="1.0" encoding="UTF-8"?>
<jboss-ra xmlns="http://www.jboss.org/schema/ra/2.0"
 xmlns:xsi="http://www.w3.org/2001/XMLSchema-instance"
 xsi:schemaLocation="http://www.jboss.org/schema/ra/2.0 file:/dati/project/RH/jboss-jca/common/src/main/resources/schema/jboss-ra_2_0.xsd">
    <ra-config-property override-element="resourceadapter">
        <ra-config-property-name>ra-config-property-name0</ra-config-property-name>
        <ra-config-property-type>java.lang.Boolean</ra-config-property-type>
        <ra-config-property-value>ra-config-property-value0</ra-config-property-value>
    </ra-config-property>
    <ra-config-property override-element="resourceadapter">
        <ra-config-property-name>ra-config-property-name1</ra-config-property-name>
        <ra-config-property-type>java.lang.Boolean</ra-config-property-type>
        <ra-config-property-value>ra-config-property-value1</ra-config-property-value>
    </ra-config-property>
    <bean-validation-groups>
        <bean-validation-group>bean-validation-group0</bean-validation-group>
        <bean-validation-group>bean-validation-group1</bean-validation-group>
    </bean-validation-groups>
    <bean-validation-groups>
        <bean-validation-group>bean-validation-group2</bean-validation-group>
        <bean-validation-group>bean-validation-group3</bean-validation-group>
    </bean-validation-groups>
    <bootstrap-context>bootstrap-context0</bootstrap-context>
</jboss-ra>
